data/summary/avg_ride_length_filtered_by_day_and_rider_type.csv

day_of_week_num,day_of_week,member_casual,avg_ride_length_minutes
0,Monday,casual,19.91
0,Monday,member,11.95
1,Tuesday,casual,17.34
1,Tuesday,member,11.84
2,Wednesday,casual,16.45
2,Wednesday,member,11.75
3,Thursday,casual,17.39
3,Thursday,member,11.79
4,Friday,casual,19.42
4,Friday,member,12.16
5,Saturday,casual,22.37
5,Saturday,member,13.41
6,Sunday,casual,23.02
6,Sunday,member,13.48

docs/case_study_report.md

### Finding 4

Filtered average ride length by day for casual riders:
- Monday: 19.91
- Tuesday: 17.34
- Wednesday: 16.45
- Thursday: 17.39
- Friday: 19.42
- Saturday: 22.37
- Sunday: 23.02

Filtered average ride length by day for members:
- Monday: 11.95
- Tuesday: 11.84
- Wednesday: 11.75
- Thursday: 11.79
- Friday: 12.16
- Saturday: 13.41
- Sunday: 13.48